overall,verified,reviewTime,reviewerID,asin,style,reviewerName,reviewText,summary,unixReviewTime,vote,image
4.0,False,"11 21, 2013",AYNTULRNAIPNY,B00EZPXYP4,{'Platform:': ' PC Disc'},Young@Heart,"Sounds great, works ok, but I really miss some of the old Norton products. For the technologically challenged like myself, a perfect all around solution for a program that is supposed to protect and help maintain my computer, would do a bit more than just back up files and clean my hard drive. This is a good product, and even though I do not have a great understanding of how software works, I do know from first hand experience that Norton has been the best of the Anti-virus programs, out of the several I have tried in the past.

I do recommend, but I just wanted something that did more","Good, could be better",1384992000,,
5.0,False,"11 19, 2013",A17WM3NTCID9DS,B00EZPXYP4,{'Platform:': ' PC Disc'},Robert D. Harmon,"I've been using Norton/Symantec products for over 10 years now, and am familiar with their characteristics and how they've evolved.

This product comes boxed, with an instruction card (with product code) and CD. I installed on 3 PCs, 2 of them Windows Vista, and one PC a Windows 7 platform. It installed smoothly in all caes.

It also installed the latest Norton toolbar, including Vault which can be helpful as a way of bringing up password-protected sites, and this latest Norton imported my passwords intact (including the password to open Vault). These days, when you need different (and un-memorizable) passwords for every site, this function is more important than ever. This latest version of Vault is more user-friendly and intuitive.

You can load from the CD or online from Norton. One oddity if you download online: in Windows it doesnt automatically load to the usual Download file, at least not in Vista. I had to specify a folder. Ive loaded from the CD and it seemed easier, at least in Vista.

Some features I haven't seen before:
1. Option to install from the furnished CD or to go to Norton online and enter the product code. If the latter, be advised it takes some time to download even with DSL. Once I had done so, it finished and installed with no problem and no apparent need for updates that day. It helps if you already have a Norton account but you can set one up.
2. The CD can serve as a recovery disk. You will need to set your computer to boot from disc, before the need arises.
3. After installation, Norton online support came up with this: I want to download my Norton product on my device. Protecting your devices and managing your Norton product is as easy as adding a new device in the Norton Management portal. Follow these instructions to install or reinstall ...

Since I used this product for three PCs on a home LAN, this was not essential but it was an interesting option, but seems more useful if you have other types of devices.

I have had no software or security problems so far, the features  file cleanup, disk optimization, startup manager, firewall management  seem to be as good as in recent, previous versions.

Strongly recommend. Security software is an essential and this is a good one.",a good update,1384819200,,
5.0,False,"11 19, 2013",A2XRZV63X79YSJ,B00EZPXYP4,{'Platform:': ' PC Disc'},Movie Mania,"I have been using Norton since I bought my first laptop ten years ago and have loved it.  I have never had a problem in all those years.  The 360 takes Norton Antivirus to a new level and is excellent.  This is easy to install.
The one complaint that I have had in the past is the extra files it downloads for extra subscription services but it seems they have either stopped this practice or they don't pop up like they used to. So this is just a minor warning but I think they have fixed it.
You can load this to three different devices for the same price.",The 2014 version of a great product.,1384819200,,
5.0,False,"11 15, 2013",A21BVL7PKG9BX8,B00EZPXYP4,{'Platform:': ' PC Disc'},Yoda OK,"Ok...with Norton, you either love it or hate it...there is no middle of the fence when it comes right down to it. Me, I love Norton, and Norton 360 is no exception. I've been using Norton products for a long time and even tried other similar products in the past, but always have found my way back to Norton products. In the past, Norton seemed to slow down my computer, which is why I tried other programs that were similar. The newer Norton programs don't do that. I have an older laptop running windows 7 and Norton does not slow my computing speed down at all. I love all the protection the 360 provides. Norton has caught and stopped more than one attack on my computer and has also caught viruses that I'm not sure other programs would have stopped. Love that I can buy it once and put it on 3 different computers, but be aware that the 1 year count down for the product starts with the 1st computer you install it on.",Norton 360 is great protection,1384473600,,
4.0,False,"11 14, 2013",A23J1T7UNX14TK,B00EZPXYP4,{'Platform:': ' PC Disc'},Nolan Lewis,Just as always Norton releases another good product. Not in awhile have I had issues with Norton bogging my system down. Runs silently and efficiently on the sidelines protecting your pc. Seems to do the job has stopped a few intrusions but never had anything major enter to really test. The 3 licenses is a good bonus for people who have multiple systems. Good system protection.,Good system protection.,1384387200,,
5.0,False,"11 7, 2013",A2FBPS1P12N24T,B00EZPXYP4,{'Platform:': ' PC Disc'},Medianvalued,"It is over 30 years since I got my first PC and 50 years since I wrote my first computer program. I've pretty much worked with computers all my life - and, since day one, I have always wanted things to be easy.  I always reasoned that silicon chips have a really lousy union and they should do all the grunt work not me.

Well, Norton's 360 product just about fits the bill.  I get to protect 3 computers on one subscription (are you hearing this Microsoft?).  Installation is pretty easy and the program pretty much runs itself and updates itself automatically.  I really don't know everything the product does (OK I'm a computer expert but that doesn't mean I want to know everything about every product - I want things to be easy) but it covers the essential like virus protection and performance checking pretty thoroughly.

It does have a function that will back up your system to their (I guess) cloud but it costs money - I prefer to spend less than $100 and get several years worth of backup for all my computers by buying an external/removable disk drive with 1 or 2 or 3 terabytes (that's an ocean of backup space) for all of my computers.",Getting this is a no-brainer,1383782400,8,
2.0,False,"11 7, 2013",A3H7ADUP07D93H,B00EZPXYP4,{'Platform:': ' PC Disc'},J. Fuchs,"I switched to Norton after a decade + with Trend Micro, and I'm not really happy with the switch.

It is, of course, difficult to tell how well any security program is working without intentionally visiting infected sites, which I'm not about to do.  So I'm operating on the assumption that Norton is detecting viruses and spyware as well as Trend, though I have no way of being sure.

My problem with Norton is that it makes everything else run very slowly.  Outlook, in particular, takes forever to open and programs frequently hang.  I have an older PC desktop running Windows 7, but it handles most software without noticeable delay -- or at least, it used to.

Norton also lets a surprising number of pop-ups get through, which Trend never did.  I never realized how many of these Trend actually caught, until it was gone.

All in all, unless someone running tests on Norton verifies that it does a much better job than other programs at catching the nasties, I can't recommend it.","Extremely slow, and not very good with pop-ups",1383782400,,
5.0,False,"11 7, 2013",A47D5C32VLQM2,B00EZPXYP4,{'Platform:': ' PC Disc'},SirenPrincess,"Norton is THE BEST when it comes to internet security.  This particular product gives you 3 licenses, which you know you're eventually going to want another license if you buy computers often, so I definitely recommend going ahead and getting the 3 pack like this.  Norton has prevented several viruses from infecting my computer.  When I've tried competitors they've let things through.  I also love the Norton 360 for the password management system, which keeps track of all your passwords even across computers.  It really is a game-changing product.  I would not own a computer without Norton installed on it.",Don't own a computer without Norton,1383782400,,
5.0,False,"11 7, 2013",A22BBLTS1YPFPE,B00EZPXYP4,{'Platform:': ' PC Disc'},MooncatX aka Bliss Crimson,"I've used Norton before and various free anti-virus, and with a professional version you get a more comprehensive set of security options that quietly takes care of business in the back ground.  There is a peace of mind factor that a professional version gives you, and for the less than tech savvy it's a bit more idiot proof than a bare bones free ware.  I have no problem with free ware, as my computing needs are pretty simple, but a pro version is very nice and this is pretty cheap for the year long comfort of install it and then pretty much forget about it security.  I got this current product via the Vine, but I have bought the professional 360 Norton for the two years running previously when it has been on sale.  I have multiple computers so the 3 license is handy and I do tend to use all three.  For the most part Norton is comfortable and user friendly especially if you aren't overly expert with using software.",Easy Security,1383782400,,
