overall,verified,reviewTime,reviewerID,asin,style,reviewerName,reviewText,summary,unixReviewTime,vote,image
3.0,True,"05 3, 2014",A1QA2NTJYW5W0C,B00EZPXYP4,{'Platform:': ' PC Download'},Clifford H. Campen,"I bought this when it was offered at a special price and use it in a household with G Data Internet Security.  It is installed on a PC which is used by my wife who likes free games.  That said Norton 360 does not handle PUP (potentially unwanted programs) at all well.  I will also comment that Free Ride Games deserves a solid slap for delivering a host of unwanted programs.  Where the user has the opportunity to decline these programs the screens where you must accept or decline these programs are deceptive.  Just as a comment to how Symantec Systems (Norton) does business this software ultimately was purchased to replaced PC Tools Internet Security.  Symantec Systems bought PC tools and then took them off of the market forcing me to change the antivirus software on 6 computers in the family.  Folks with a long memory will remember that this is not the first time that Symantec has done this with good products.  360 is an older attempt at an antivirus, system tune-up, back-up software and I don't think it does anything well.  Norton offers another antivirus program and if you must use Norton - folks have good luck with them.  I would recommend that they have more dedicated antivirus offering and that prospective buyers should investigate that..",Probably Not Norton's Best,1399075200,,
4.0,True,"04 13, 2014",A2HLVJ7S6VGA4,B00EZPXYP4,{'Platform:': ' PC Download'},DU in Hawaii,"Since I've gotten Norton, I have seen various atacks where Norton prevented an invection and any resulting problems.  I especially like Identity Safe which automattically inserts my user name and password.  I'm just a casual user so what I don't know is if Norton is slowing down my notebook.  I guess at some point in time I may remove it just to see.  However, I usually find that with time, Windows almost always inevitably slows down.

I was going to switch to Kaspersky, but read that Kaspersky is somewhat heavy and is known to slow down the OS, even if slightly. Since I like Identity Safe, I decided that for at least one more year, I would stay with Norton.",Seems to work well,1397347200,,
1.0,True,"04 13, 2014",A1U98C6PV9IBZA,B00EZPXYP4,{'Platform:': ' PC Download'},Binkie,It's like i was many years ago. It's a memory hogg and slows down my computer to a crawl. Uninstalled and ordered Kaspersky Anti-Virus.,Horribly,1397347200,,
5.0,True,"04 12, 2014",A2DMQB5ZGGSSBO,B00EZPXYP4,{'Platform:': ' PC Disc'},Mark,Always purchase it for next year when on sale. Easy to install. I recommend this product. Not had a virus in 5 years of using it.,Nice price,1397260800,,
5.0,True,"04 1, 2014",A11T43WK7C7OR4,B00EZPXYP4,{'Platform:': ' PC Download'},Olmstr,I have two win 7 and one win 8.1 machine that I don't have to worry about catching a bug.  Also have a MAC that never fails but at least now my Win machines are secure.,"Mines securre, is yours?",1396310400,,
4.0,True,"03 20, 2014",A2WYTI7RYF2A29,B00EZPXYP4,{'Platform:': ' PC Download'},Frank P,Norton 360 is a good product. But beware if you install it before your current subscription expires it resets your expiration date for only one year.,Used Norton for Years,1395273600,,
1.0,False,"03 12, 2014",A3OPKL03NFOSZJ,B00EZPXYP4,{'Platform:': ' PC Download'},Gus,"I have been using Norton for a long time, ever since the Norton Utilities and this is something that really irks me, as it would you. I had 41 days left on my subscription, when I clicked on the link in the control screen to renew now it took me to their web site where it clearly states that a 2 year subscription for the product was 59.99. I clicked on the ""Renew Now"" button and went through all their steps, never being aware that I was being switched to their Premier eddition for 2 more devices and only one year. When it finished I checked the number of days left on the license and it showed only 366. Not only did it upgrade me without me wanting it, but it ate my 41 days.
Contacted customer support, which tried to appease me by adding the 41 days, which never happened. I requested to be escalated to a supervisor, and I am still waiting for a call back. They requested 48 hours to resolve the issue! Unheard of! If I treated my customer this way I would not have any customers. Stay tuned for the supervisor response.
My advice is to get something else, or instead of renewing the subscription buy a new version from Amazon and install it after your old license expires.
Update: Support didn't call back within the promissed time frame, instead they called Sunday morning and sent an email, nice trick, they know most people are not available at that time. What they asked for was the link to the renewal site, I told them the same thing as before, the product has been updated, the link is not the same!
As much as I hate to say it, I will be looking for a new product next year, but not McAfee, they have the same issues with support, and it does not work well on a multi-processor machine, it sets you up more than once for the same device!",Beware of subscription renewals that actually upgrade you to a new product for less time.,1394582400,3,
2.0,False,"03 11, 2014",A2P6QCZWW3H1X6,B00EZPXYP4,{'Platform:': ' PC Download'},Londonnoise,"I think as Norton have tried to add more features, this thing has become too bloated and also too 'vocal' with popups coming up for everything, just like it needs to justify it's existence and expense somehow. I honestly think that the less resource-intensive and free offerings such as the Microsoft offering and even AVG, coupled with taking some care what attachments and links you click on are far better than spending money on this sort of thing.",Too 'Spammy',1394496000,,
5.0,True,"03 10, 2014",A2VWE5SGNDS8HW,B00EZPXYP4,{'Platform:': ' PC Download'},tachi1,"Norton has gotten more thorough and un-intrussive as time goes on. It stays more in the background, seems to draw less computing power, and is less domineering than it used to be. It has always been a good anti-virus program, but it used to cause as many conflicts as it prevented (there used to be the .dll file that was a source of annoyance through several versions!); and didn't interact well with other programs and/or make its presence felt in many annoying ways.

Luckily, it has put all that behind it: it works in the background; doesn't interfere unless it has to due to a real threat; doesn't slow anything down; doesn't try to run the show; and still gives you a level of protection that makes you feel secure.",Very pleased with how the program works.,1394409600,,
5.0,True,"03 8, 2014",A1WPTHYWUTEIZQ,B00EZPXYP4,{'Platform:': ' PC Download'},BuckStar69,"I have been a Norton user for a long time and have been happy with my results. Have never had any issues with viruses, malware and the like, so I guess it has been working. It gives me a monthly recap of what has happened. Plus, this version has a password manger (which I love) and some other utilities. It is a good buy.",What's not to like,1394236800,,
4.0,True,"03 5, 2014",A2A33I5BISEN03,B00EZPXYP4,{'Platform:': ' PC Disc'},Alestair David,"I have been using Norton 360 for sometime and have no problem with the software. The main problem is with Norton customer support. It takes too long even to ""chat"" online.",Good security software,1393977600,,
5.0,True,"02 24, 2014",A7NUXXOKGQQKP,B00EZPXYP4,{'Platform:': ' PC Disc'},Thomas Serface,"I've been using Norton 360 for a few years and I've found it is cheaper to just buy a new copy every year than it is to upgrade the subscription from Norton so I just order order it from Amazon.  I think that paradigm is weird, but I save a few $$$ so I don't mind reinstalling.  It's smart enough to uninstall the previous version first.

The virus, spyware, and email spam checkers are my favorite and they don't slow down the computer much that I can tell.",Still works,1393200000,,
5.0,True,"02 21, 2014",A3QIQLPZGYQ3AJ,B00EZPXYP4,{'Platform:': ' PC Disc'},Long time customer,worked great,Five Stars,1392940800,,
4.0,True,"02 19, 2014",A1501C38OCSEMA,B00EZPXYP4,{'Platform:': ' PC Download'},Ymjauthor,"There's not a whole lot more to say about this Norton product. I've been using Norton for year. Even back in the day when you could buy one license software version and without having to pay for a new version each year, you could just download updates. Long gone are those days. The stickler part of this is that we need protection for our electronic devices. I will say, that last year I paid $80 for this software from the Norton website, but I purchased this download from Amazon for only half that price. Keep that in mind when it comes to renewing your virus software.",What You've Come to Expect From Norton,1392768000,,
5.0,True,"02 15, 2014",A37SGUQGIDFOKK,B00EZPXYP4,{'Platform:': ' PC Download'},Lee,I purchased this to upgrade my software.  I liked the multiple programs all in one.  I would definitely recommend this.,Norton 360 2014,1392422400,,
4.0,True,"02 13, 2014",A24AB6DJ00YOJ6,B00EZPXYP4,{'Platform:': ' PC Disc'},Dan,"I've used Norton products for years and haven't had any issues.  I personally think Norton 360 gives you ""more bang for your buck"" and just upgraded to the 2014 edition.  I do however like to have the CD version vs downloading.  Also you save a lot of money by buying through Amazon rather than renewing on the Norton site.",Great Product,1392249600,,
5.0,True,"02 10, 2014",A36JD4TF3WHDQ5,B00EZPXYP4,{'Platform:': ' PC Download'},george,"Had used Symantec System Works (??), which included Norton Anti-Virus, for years.  Then in the past couple or so years it seems to have morphed into Norton 360.  Have always purchased the CD previously ... until this year.  This time I purchased the download version, i.e. no CD.  Maybe just me, but don't recall having an issue in the past couple of years, but this time... installed 3 or 4 times and, afterwards, E-V-E-R-Y time it would indicate that there were 2 days remaining (should have been 360 days!!). Contacted Symantec via online chat, rep was VERY helpful, fixed in mere moments (maybe 1 minute). I was directed to open Norton from the desktop, click on a tab (sorry, don't remember which), tell Norton to update, and TA-DA!",Excellent All-Around Virus-Tune up-Back up-Etc Software,1391990400,,
5.0,True,"02 1, 2014",A2N2XU3U2LYUZS,B00EZPXYP4,{'Platform:': ' PC Disc'},wla755,Used this product to continue my subscription for another year.  It was a good value when purchased in the bundle with turbo tax.,Met my expectations,1391212800,,
5.0,True,"01 31, 2014",A3TDR5VQPREEMA,B00EZPXYP4,{'Platform:': ' PC Download'},Amazon Buyer,At this sale price you cannot beat it.  I have been using Norton products for over 20 years and always find great deals before I renew.  This is the best so far though the price went up the next day because it was a one day only sale.  I think the current price for the download is still pretty good,What can you say...,1391126400,,
1.0,True,"01 27, 2014",A2MKY8OUI8GZG1,B00EZPXYP4,{'Platform:': ' PC Download'},Big shopper,"I trying clicking ""spam"" and nothing happens.  Has not worked since last update.  Disappointing.  Cannot find a fix.  What am I supposed to do?",Does not work,1390780800,,
4.0,False,"01 12, 2014",AYKFN6Z2Q457S,B00EZPXYP4,{'Platform:': ' PC Disc'},Alfie,Worked but too expensive compared to competition.  I renewed and used it for many years but found a more reasonably priced item that I now use.,Works Nicely,1389484800,,
5.0,True,"01 7, 2014",A3AGWK1O5U0QK0,B00EZPXYP4,{'Platform:': ' PC Disc'},suzukiman,"I am not a fan of total control by the heavy weight software protection systems offered by Norton (360, Internet Security, and such). I don't like the fact that these programs literally take over the entire Windows operating system and funnel EVERYTHING YOU DO thru the Norton servers for inspection. I also don't like the fact that putting this heavy weight software on a Windows computer can, and does, slow the machine down dramatically. Hence, I limit myself to using on Norton Antivirus, which I really do like.

My goodness... I just set up a new Dell computer for a friend (who is somewhat computer challenged), and he insisted on Norton 360. I installed Norton 360 on his new Dell, after deleting the default antivirus software Dell puts on their computers. And I was a little surprised at the efficiency of Norton 360. I didn't seem to be the big elephant in the room. It was much quieter, less annoying and ate fewer system resources.

I suppose this is an improvement that deserves praise. BUT I still don't like giving up complete control of my Windows operating system to Norton 360. I'm sorry, I just don't.","Funny thing about 360, I've changed my mind",1389052800,,
4.0,False,"12 19, 2013",A2U6GHU2EMC5M5,B00EZPXYP4,{'Platform:': ' PC Disc'},Rawim,"I remember back in the day.  Norton was really the only game in town when it came to anti-virus protection.  Then came along McAfee and we had some competition.  Now there are a multitude of options out there and I have had some experience with just about all of themand to be honest I still think Norton is the best.

Reasons for that: I feel Norton still spends the most resources on updating and fighting new threats compared to others.  I have interacted with them before on a particular virus problem and they were very good and very professional.  And I believe they take very seriously all the threats that are out in the world.

360 is Nortons kind of all in one product, meaning it focuses on everything from viruses in downloads, scams in email, outside intrusions into your personal network.  The software really does try to offer a 360 degree protection for your machine.

This is a one user, three license product, meaning it is intended for one person to use on perhaps three different machines.  You basically sign up for your Norton account and you can now download the software on to three separate machines.  One desktop, two laptops; or two desktops and one laptop, you get the picture.  You can move the licenses if you need to but it is a bit of a hassle.  As uninstalling Norton is never easy.

The two biggest negative things I have to say about Norton is that, one, it is a resource hog.  You really need a somewhat up to date computer.  Anything too old or two slow and this software can cause things to come to a crawl on your computer.  You won't have any viruses, but your computer will run pretty darn slow.

The other thing I don't like is the control scheme, Norton can be really easy to use, if you let Norton do what it wants, but if you are a power user, and you like to change a lot of settings and really control what Norton does and when it does it, it is harder rather than easy.  I wish Norton would have two different interfaces.  One for regular users, and perhaps one for power users that allows easy changing or settings.

Other than those two issues I still like the product and will continue to use it.  If you have a question about the product, feel free to leave a comment below and I will try to answer it.","Not Perfect, But Still The Best",1387411200,,
5.0,False,"12 18, 2013",A9LNWA25IM2DX,B00EZPXYP4,{'Platform:': ' PC Disc'},R.Suarez,"I have been using Norton 360 for years, renewing as required after some bad experiences with McAfee. My prior Norton 360 license was about to expire when I was offered the 2014 version, which I did not hesitate to order. The first difference I noted is that, contrary to prior installs, this time I had to uninstall the old license to be able to install the new one (rather than simply updating the required files), the whole uninstall/install process took less than ten minutes.

Another thing I noticed was different is that the security ID application is not installed as a part of the whole application, a link will take you to the Norton website where you can download and install. This is one of the features I use the most so for a moment there I was worried I would have to purchase separately.

My experience with Norton 360 has always been great and this time it was not different, so far, there are no performance issues in my laptop that could be associated to the antivirus running in the background (which does happen with McAfee) and the interface is really easy to use and get used to if you are a new user.

I have yet to decide whether or not to install in my iPhone, this is of course an upgrade, as the prior version was compatible with Android only.

1 user that includes 3 licenses is pretty neat for the protection you get; as a part of the package you are also offered backup storage for up to 2GB, this may not be too much but I am certain it will be useful to more than one person. In days in which external drives are the norm, 2GB may not seem as much, but if used to backup essential data that you may need if on the run, well, it may be worth it.

My external drives I only use at home and at the office so it is great to have the protection on to ensure any potential threats are identified. The thing I use the most is the online protection, in the past, Norton 360 has helped me avoid malicious attacks and potential unsafe websites, also the functionality to save all your passwords under a single Norton account is amazing.

I am getting what is offered and to me, that is all that matters: Ultimate piece of mind",Ultimate piece of mind,1387324800,,
4.0,False,"12 16, 2013",A1W7R5ZAGVOSVQ,B00EZPXYP4,{'Platform:': ' PC Disc'},Imajin8,"Like others I was using Norton McAfee before.  Here's what I liked about this - and the one thing that keeps it from getting five stars.
1. Doesn't take as much RAM
2. Not a lot of annoying pop-ups and things telling I need to do something
3. All-in-one perfection ease - covers everything so that I don't have to have another protect me from various web issues (phishing, putting data in unsecure sites, etc.)
4. Covers up to three computers --- my laptops and my desktop.
5. Ease of set-up - simple, accomplished in no time and it simultaneously (w/ my permission) removed my McCaffee

One downside on mine and one that I've heard from a friend (am not counting that one towards my review - but, might want to be something you check out if it relevant to you...)
Mine: Lately, it has random crashes of the web site protection feature.  Doesn't hurt my computer - but just stops working and tells me so.  So far, haven't had any security breaches I know of.
A friends: He used a VPN connection on his computer and something in the Norton settings messed it up entirely (those VPN connections can always be a little tricky to me - and I don't have one on any of the ones I've installed it into)

BOTTOM LINE: I like it far better and feel better protected with this easy to use all-in-one security system over McCaffee and it's priced much lower than I paid for that one for a single license.","Very good, easy to use all-in-one protection at a good value",1387152000,,
4.0,False,"12 10, 2013",A2H2I5FY1PUHP1,B00EZPXYP4,{'Platform:': ' PC Disc'},Boilermate,"Unlike some other reviewers, I had absolutely no problems installing this version of Norton 360. It uninstalled BitDefender and cleanly installed itself. Installation was clean and simple and in default mode it will adequately protect you from the scourges of the Internet.

I did notice some system lag, especially when checking outgoing emails with attachments (and not even very large ones). Otherwise it works quietly in the background. If you so desire you can tweak the settings to your liking.

Overall, you can't go wrong with this tried-and-true software. And with three licenses can protect your other devices as well.",Reliable Protection for Your Computer,1386633600,,
5.0,False,"12 10, 2013",A1ST9PG26FSN2H,B00EZPXYP4,{'Platform:': ' PC Disc'},Thomas Paul,"First, don't buy this from the Norton site or let your version automatically renew.  It is much cheaper to buy it new from Amazon. Just make sure that after you install it you go to the Norton site and turn off the automatic renewal if it is on.  Norton will warn you a month before they renew so if you forget you will have time to turn it off.

I have been using this product since it came out and it just gets better and better.  I have never had problems with it chewing up memory.  It just runs in the background and warns me if anything seems out of place.  The installation is easy enough and setup involves almost nothing.  It does ask to install a toolbar which you can turn on or off from your browser.  It includes some space for automatic backup (have some college papers you are working on or photos you love) and you can buy more if needed.  The backup runs when you aren't using the computer so you don;t even notice it is happening.

As to it's handling of viruses, I have never had a problem on any of the three computers this product has been running on.  I strongly recommend Norton 360.",A bargain at this price,1386633600,4,
5.0,False,"12 1, 2013",A2068BC3ZXAVJQ,B00EZPXYP4,{'Platform:': ' PC Disc'},scesq,"I have been using Norton products for years and have seen a continual improvement over time.  Norton 360 is everything I want in an Internet security program.

This is the third of four programs (each offering something more) offered by Norton to protect computers. There is Norton Antivirus, Norton Internet Security, Norton 360 and Norton 360 Multi-Deivice.  Norton 360 Multi-Device allows you to add protection to smart phones and tablets as well as computers. Norton also has a line of mobile and tablet security.

Once you purchase this you get a one year subscription. After the year is up you can either buy another year of service from Norton or buy the product from a third party like Amazon. In my case I was given the opportunity to review this for free through the Vine program so jumped at the chance to do so.

One of the nice features with Norton is that once installed it will always update to the latest version of the software you purchased. As a result of this there is no pressure to try the new and improved version because you are getting the newest version of the software you purchased.

When you press the Norton icon you get a screen that has security, identity, backup and tuneup options.  Each option gives you a number of choices such as when to run scans or updates or how to manage identity protection. It is easy to use and ideal for people who are not computer experts.

Norton Safe Search will also appear when I search the Internet.  There is a search box and if you go through it Norton will let you know if a site is safe or not.

One of the things I like about Norton is there is 24 hour live free technical support available for issues with installation or product use in general. I had an issue this year that may have been virus related and I called technical support. The agent addressed my concern and thankfully it was not a virus issue.

Over the past year I have had a couple of warnings that a virus had been blocked.  I have yet to have a virus problem in the years I have been using Norton products.

When you buy a Norton product you get 365 days of updates to keep your computer protected from the latest spyware and virus threats.  I had four months of my subscription left and a Norton agent was able to add that to the year that came with this product.

When I first started using Norton many years ago I would use additional programs for added protection against spyware. I just use Norton now. I am confident that it will protect my computer from virus or spyware issues. Additionally when scans are running I can still work on my computer without everything slowing down.

Norton continues to impress me.",Excellent Internet Security Software,1385856000,,
5.0,False,"11 22, 2013",AEQYAG42F9128,B00EZPXYP4,{'Platform:': ' PC Disc'},BobL,"I just bought another copy of the ""older"" N360 2013 for the new registation Key, but I've been running this newer ""2014"" version for a few months already. Norton has the nice feature of alway being able to upgrade to the latest version as long as your subcription is still current. I have a little over 2 months left on my current N360 subscription and saw the 2013 version available a  nice price here on Amazon, so I bought another 3PC one user box. I have to wait untill my current subscription expires or a day or so untill it does to enter the new KEY, because if I did it now, I would lose the remainder of my current subscription.

OK, I've said enough that is not really review material, but should be useful to anybody using Norton.
Review-wise, I think Norton 360 is a great product and works well for me. The only issue I have with it is the stupid cloud based  (these days) password ""vault"". I preferred the older, local  password manager, which on one of my PC's, is the way I still have it set up. I made the mistake of logging onto Symantec one day with my user ID and password, and it kind of ""Grabbed"" my password manager and made it the cloud based vault thing, which sounded OK, but when I logged into it with my Laptop, which had fewer log-ins and passwords, it for some crazy reason synched the cloud data FROM my laptop. When I used my desktop next time, the Cloud password data got synched TO my desktop and I lost 3/4 of my log ins and passwords. Fortunately, I back up my passwords to a local hardrive file with a built in, but awkward to find utility in Norton to import or export, and I was able to get it all back.
Other than that quirk. I like the software a while lot. It runs smotthly, and does not cause my PC's to crash. That IS pretty bad, but I was able to recover.",I like Norton 360!,1385078400,3,
